"No.","Time","Source","Destination","Protocol","Length","Info"
"1","0.000000","zhiyicommuni_49:83:8c","Broadcast","ARP","60","Who has 192.168.101.13? Tell 192.168.101.1"
"2","0.000074","AzureWaveTec_df:75:0d","zhiyicommuni_49:83:8c","ARP","42","192.168.101.13 is at 14:13:33:df:75:0d"
"3","0.572145","200.25.7.126","192.168.101.13","TCP","54","80  >  52490 [FIN, ACK] Seq=1 Ack=1 Win=21 Len=0"
"4","0.572145","200.25.7.126","192.168.101.13","TCP","54","80  >  52488 [FIN, ACK] Seq=1 Ack=1 Win=21 Len=0"
"5","0.572145","200.25.7.126","192.168.101.13","TCP","54","80  >  52489 [FIN, ACK] Seq=1 Ack=1 Win=21 Len=0"
"6","0.572945","192.168.101.13","200.25.7.126","TCP","54","52490  >  80 [ACK] Seq=1 Ack=2 Win=255 Len=0"
"7","0.572945","192.168.101.13","200.25.7.126","TCP","54","52488  >  80 [ACK] Seq=1 Ack=2 Win=251 Len=0"
"8","0.572947","192.168.101.13","200.25.7.126","TCP","54","52489  >  80 [ACK] Seq=1 Ack=2 Win=255 Len=0"
"9","0.573093","192.168.101.13","200.25.7.126","TCP","54","52489  >  80 [FIN, ACK] Seq=1 Ack=2 Win=255 Len=0"
"10","0.573156","192.168.101.13","200.25.7.126","TCP","54","52489  >  80 [RST, ACK] Seq=2 Ack=2 Win=0 Len=0"
"11","0.573173","192.168.101.13","200.25.7.126","TCP","54","52490  >  80 [FIN, ACK] Seq=1 Ack=2 Win=255 Len=0"
"12","0.573173","192.168.101.13","200.25.7.126","TCP","54","52488  >  80 [FIN, ACK] Seq=1 Ack=2 Win=251 Len=0"
"13","0.573266","192.168.101.13","200.25.7.126","TCP","54","52490  >  80 [RST, ACK] Seq=2 Ack=2 Win=0 Len=0"
"14","0.573355","192.168.101.13","200.25.7.126","TCP","54","52488  >  80 [RST, ACK] Seq=2 Ack=2 Win=0 Len=0"
"15","0.716972","200.25.7.126","192.168.101.13","TCP","54","80  >  52489 [ACK] Seq=2 Ack=2 Win=21 Len=0"
"16","0.716972","200.25.7.126","192.168.101.13","TCP","54","80  >  52490 [ACK] Seq=2 Ack=2 Win=21 Len=0"
"17","0.716972","200.25.7.126","192.168.101.13","TCP","54","80  >  52488 [ACK] Seq=2 Ack=2 Win=21 Len=0"
"18","0.717122","192.168.101.13","200.25.7.126","TCP","54","52489  >  80 [RST] Seq=2 Win=0 Len=0"
"19","0.717171","192.168.101.13","200.25.7.126","TCP","54","52490  >  80 [RST] Seq=2 Win=0 Len=0"
"20","0.717192","192.168.101.13","200.25.7.126","TCP","54","52488  >  80 [RST] Seq=2 Win=0 Len=0"
"21","0.729194","fe80::f036:1b87:d1eb:960a","fe80::1","DNS","118","Standard query 0xaede AAAA inputsuggestions.msdxcdn.microsoft.com"
"22","0.729194","fe80::f036:1b87:d1eb:960a","fe80::1","DNS","118","Standard query 0xcd53 A inputsuggestions.msdxcdn.microsoft.com"
"23","0.815728","fe80::1","fe80::f036:1b87:d1eb:960a","DNS","225","Standard query response 0xcd53 No such name A inputsuggestions.msdxcdn.microsoft.com CNAME msdx-cdn-y86ykn8r9v.azureedge.net SOA ns1-06.azure-dns.com"
"24","0.838398","fe80::1","fe80::f036:1b87:d1eb:960a","DNS","225","Standard query response 0xaede No such name AAAA inputsuggestions.msdxcdn.microsoft.com CNAME msdx-cdn-y86ykn8r9v.azureedge.net SOA ns1-06.azure-dns.com"
"25","0.939957","2803:b2a0:82:d894:7065:ca3:f8fe:e0ed","2a03:2880:f32f:122:face:b00c:0:7260","TCP","74","52517  >  443 [FIN, ACK] Seq=1 Ack=1 Win=255 Len=0"
"26","0.943593","192.168.101.13","57.144.115.33","TCP","66","52518  >  5222 [SYN] Seq=0 Win=65535 Len=0 MSS=1460 WS=256 SACK_PERM"
"27","1.024258","2a03:2880:f32f:122:face:b00c:0:7260","2803:b2a0:82:d894:7065:ca3:f8fe:e0ed","TCP","74","443  >  52517 [ACK] Seq=1 Ack=2 Win=370 Len=0"
"28","1.024258","57.144.115.33","192.168.101.13","TCP","66","5222  >  52518 [SYN, ACK] Seq=0 Ack=1 Win=65535 Len=0 MSS=1392 SACK_PERM WS=256"
"29","1.024584","192.168.101.13","57.144.115.33","TCP","54","52518  >  5222 [ACK] Seq=1 Ack=1 Win=65280 Len=0"
"30","1.025209","192.168.101.13","57.144.115.33","TCP","331","52518  >  5222 [PSH, ACK] Seq=1 Ack=1 Win=65280 Len=277 [TCP PDU reassembled in 113]"
"31","1.042559","57.144.115.33","192.168.101.13","TCP","54","5222  >  52518 [ACK] Seq=1 Ack=278 Win=66816 Len=0"
"32","1.062487","2a03:2880:f32f:122:face:b00c:0:7260","2803:b2a0:82:d894:7065:ca3:f8fe:e0ed","TCP","74","443  >  52517 [FIN, ACK] Seq=1 Ack=2 Win=370 Len=0"
"33","1.062669","2803:b2a0:82:d894:7065:ca3:f8fe:e0ed","2a03:2880:f32f:122:face:b00c:0:7260","TCP","74","52517  >  443 [ACK] Seq=2 Ack=2 Win=255 Len=0"
"34","1.167692","57.144.115.33","192.168.101.13","TCP","111","5222  >  52518 [PSH, ACK] Seq=1 Ack=278 Win=66816 Len=57 [TCP PDU reassembled in 119]"
"35","1.167692","57.144.115.33","192.168.101.13","TCP","115","5222  >  52518 [PSH, ACK] Seq=58 Ack=278 Win=66816 Len=61 [TCP PDU reassembled in 119]"
"36","1.167872","192.168.101.13","57.144.115.33","TCP","54","52518  >  5222 [ACK] Seq=278 Ack=119 Win=65280 Len=0"
"37","1.180982","192.168.101.13","57.144.115.33","TCP","160","52518  >  5222 [PSH, ACK] Seq=278 Ack=119 Win=65280 Len=106 [TCP PDU reassembled in 113]"
"38","1.181139","192.168.101.13","57.144.115.33","TCP","79","52518  >  5222 [PSH, ACK] Seq=384 Ack=119 Win=65280 Len=25 [TCP PDU reassembled in 113]"
"39","1.181413","192.168.101.13","57.144.115.33","TCP","111","52518  >  5222 [PSH, ACK] Seq=409 Ack=119 Win=65280 Len=57 [TCP PDU reassembled in 113]"
"40","1.181526","192.168.101.13","57.144.115.33","TCP","111","52518  >  5222 [PSH, ACK] Seq=466 Ack=119 Win=65280 Len=57 [TCP PDU reassembled in 113]"
"41","1.181644","192.168.101.13","57.144.115.33","TCP","140","52518  >  5222 [PSH, ACK] Seq=523 Ack=119 Win=65280 Len=86 [TCP PDU reassembled in 113]"
"42","1.181726","192.168.101.13","57.144.115.33","TCP","136","52518  >  5222 [PSH, ACK] Seq=609 Ack=119 Win=65280 Len=82 [TCP PDU reassembled in 113]"
"43","1.181800","192.168.101.13","57.144.115.33","TCP","111","52518  >  5222 [PSH, ACK] Seq=691 Ack=119 Win=65280 Len=57 [TCP PDU reassembled in 113]"
"44","1.181879","192.168.101.13","57.144.115.33","TCP","144","52518  >  5222 [PSH, ACK] Seq=748 Ack=119 Win=65280 Len=90 [TCP PDU reassembled in 113]"
"45","1.181966","192.168.101.13","57.144.115.33","TCP","184","52518  >  5222 [PSH, ACK] Seq=838 Ack=119 Win=65280 Len=130 [TCP PDU reassembled in 113]"
"46","1.182050","192.168.101.13","57.144.115.33","TCP","111","52518  >  5222 [PSH, ACK] Seq=968 Ack=119 Win=65280 Len=57 [TCP PDU reassembled in 113]"
"47","1.182115","192.168.101.13","57.144.115.33","TCP","206","52518  >  5222 [PSH, ACK] Seq=1025 Ack=119 Win=65280 Len=152 [TCP PDU reassembled in 113]"
"48","1.182210","192.168.101.13","57.144.115.33","TCP","162","52518  >  5222 [PSH, ACK] Seq=1177 Ack=119 Win=65280 Len=108 [TCP PDU reassembled in 113]"
"49","1.182266","192.168.101.13","57.144.115.33","TCP","124","52518  >  5222 [PSH, ACK] Seq=1285 Ack=119 Win=65280 Len=70 [TCP PDU reassembled in 113]"
"50","1.182319","192.168.101.13","57.144.115.33","TCP","124","52518  >  5222 [PSH, ACK] Seq=1355 Ack=119 Win=65280 Len=70 [TCP PDU reassembled in 113]"
"51","1.182416","192.168.101.13","57.144.115.33","TCP","107","52518  >  5222 [PSH, ACK] Seq=1425 Ack=119 Win=65280 Len=53 [TCP PDU reassembled in 113]"
"52","1.182577","192.168.101.13","57.144.115.33","TCP","126","52518  >  5222 [PSH, ACK] Seq=1478 Ack=119 Win=65280 Len=72 [TCP PDU reassembled in 113]"
"53","1.182654","192.168.101.13","57.144.115.33","TCP","126","52518  >  5222 [PSH, ACK] Seq=1550 Ack=119 Win=65280 Len=72 [TCP PDU reassembled in 113]"
"54","1.182736","192.168.101.13","57.144.115.33","TCP","126","52518  >  5222 [PSH, ACK] Seq=1622 Ack=119 Win=65280 Len=72 [TCP PDU reassembled in 113]"
"55","1.182827","192.168.101.13","57.144.115.33","TCP","126","52518  >  5222 [PSH, ACK] Seq=1694 Ack=119 Win=65280 Len=72 [TCP PDU reassembled in 113]"
"56","1.182918","192.168.101.13","57.144.115.33","TCP","177","52518  >  5222 [PSH, ACK] Seq=1766 Ack=119 Win=65280 Len=123 [TCP PDU reassembled in 113]"
"57","1.182996","192.168.101.13","57.144.115.33","TCP","126","52518  >  5222 [PSH, ACK] Seq=1889 Ack=119 Win=65280 Len=72 [TCP PDU reassembled in 113]"
"58","1.183047","192.168.101.13","57.144.115.33","TCP","126","52518  >  5222 [PSH, ACK] Seq=1961 Ack=119 Win=65280 Len=72 [TCP PDU reassembled in 113]"
"59","1.183139","192.168.101.13","57.144.115.33","TCP","126","52518  >  5222 [PSH, ACK] Seq=2033 Ack=119 Win=65280 Len=72 [TCP PDU reassembled in 113]"
"60","1.183218","192.168.101.13","57.144.115.33","TCP","126","52518  >  5222 [PSH, ACK] Seq=2105 Ack=119 Win=65280 Len=72 [TCP PDU reassembled in 113]"
"61","1.183311","192.168.101.13","57.144.115.33","TCP","125","52518  >  5222 [PSH, ACK] Seq=2177 Ack=119 Win=65280 Len=71 [TCP PDU reassembled in 113]"
"62","1.183379","192.168.101.13","57.144.115.33","TCP","96","52518  >  5222 [PSH, ACK] Seq=2248 Ack=119 Win=65280 Len=42 [TCP PDU reassembled in 113]"
"63","1.228909","57.144.115.33","192.168.101.13","TCP","54","5222  >  52518 [ACK] Seq=119 Ack=384 Win=66816 Len=0"
"64","1.228909","57.144.115.33","192.168.101.13","TCP","54","5222  >  52518 [ACK] Seq=119 Ack=409 Win=66816 Len=0"
"65","1.228909","57.144.115.33","192.168.101.13","TCP","54","5222  >  52518 [ACK] Seq=119 Ack=466 Win=66816 Len=0"
"66","1.228909","57.144.115.33","192.168.101.13","TCP","54","5222  >  52518 [ACK] Seq=119 Ack=523 Win=66816 Len=0"
"67","1.228909","57.144.115.33","192.168.101.13","TCP","66","[TCP Dup ACK 66#1] 5222  >  52518 [ACK] Seq=119 Ack=523 Win=67840 Len=0 SLE=691 SRE=748"
"68","1.228909","57.144.115.33","192.168.101.13","TCP","66","5222  >  52518 [ACK] Seq=119 Ack=609 Win=67840 Len=0 SLE=691 SRE=748"
"69","1.228909","57.144.115.33","192.168.101.13","TCP","54","5222  >  52518 [ACK] Seq=119 Ack=748 Win=67840 Len=0"
"70","1.228909","57.144.115.33","192.168.101.13","TCP","54","5222  >  52518 [ACK] Seq=119 Ack=838 Win=67840 Len=0"
"71","1.228909","57.144.115.33","192.168.101.13","TCP","54","5222  >  52518 [ACK] Seq=119 Ack=968 Win=68864 Len=0"
"72","1.228909","57.144.115.33","192.168.101.13","TCP","54","5222  >  52518 [ACK] Seq=119 Ack=1025 Win=68864 Len=0"
"73","1.228909","57.144.115.33","192.168.101.13","TCP","56","5222  >  52518 [ACK] Seq=119 Ack=1177 Win=69888 Len=0"
"74","1.228909","57.144.115.33","192.168.101.13","TCP","56","5222  >  52518 [ACK] Seq=119 Ack=1285 Win=69888 Len=0"
"75","1.228909","57.144.115.33","192.168.101.13","TCP","56","5222  >  52518 [ACK] Seq=119 Ack=1355 Win=69888 Len=0"
"76","1.228909","57.144.115.33","192.168.101.13","TCP","56","5222  >  52518 [ACK] Seq=119 Ack=1425 Win=69888 Len=0"
"77","1.228909","57.144.115.33","192.168.101.13","TCP","56","5222  >  52518 [ACK] Seq=119 Ack=1478 Win=69888 Len=0"
"78","1.228909","57.144.115.33","192.168.101.13","TCP","56","5222  >  52518 [ACK] Seq=119 Ack=1889 Win=69888 Len=0"
"79","1.228909","57.144.115.33","192.168.101.13","TCP","56","5222  >  52518 [ACK] Seq=119 Ack=2033 Win=69888 Len=0"
"80","1.228909","57.144.115.33","192.168.101.13","TCP","56","5222  >  52518 [ACK] Seq=119 Ack=2105 Win=69888 Len=0"
"81","1.228909","57.144.115.33","192.168.101.13","TCP","56","5222  >  52518 [ACK] Seq=119 Ack=2290 Win=69888 Len=0"
"82","1.393661","57.144.115.33","192.168.101.13","TCP","100","5222  >  52518 [PSH, ACK] Seq=119 Ack=2290 Win=69888 Len=46 [TCP PDU reassembled in 119]"
"83","1.393661","57.144.115.33","192.168.101.13","TCP","107","5222  >  52518 [PSH, ACK] Seq=165 Ack=2290 Win=69888 Len=53 [TCP PDU reassembled in 119]"
"84","1.393661","57.144.115.33","192.168.101.13","TCP","93","5222  >  52518 [PSH, ACK] Seq=218 Ack=2290 Win=69888 Len=39 [TCP PDU reassembled in 119]"
"85","1.393661","57.144.115.33","192.168.101.13","TCP","116","5222  >  52518 [PSH, ACK] Seq=257 Ack=2290 Win=69888 Len=62 [TCP PDU reassembled in 119]"
"86","1.393902","192.168.101.13","57.144.115.33","TCP","54","52518  >  5222 [ACK] Seq=2290 Ack=319 Win=65024 Len=0"
"87","1.394722","192.168.101.13","57.144.115.33","TCP","90","52518  >  5222 [PSH, ACK] Seq=2290 Ack=319 Win=65024 Len=36 [TCP PDU reassembled in 113]"
"88","1.394806","192.168.101.13","57.144.115.33","TCP","100","52518  >  5222 [PSH, ACK] Seq=2326 Ack=319 Win=65024 Len=46 [TCP PDU reassembled in 113]"
"89","1.394848","192.168.101.13","57.144.115.33","TCP","93","52518  >  5222 [PSH, ACK] Seq=2372 Ack=319 Win=65024 Len=39 [TCP PDU reassembled in 113]"
"90","1.394925","192.168.101.13","57.144.115.33","TCP","88","52518  >  5222 [PSH, ACK] Seq=2411 Ack=319 Win=65024 Len=34 [TCP PDU reassembled in 113]"
"91","1.396186","192.168.101.13","57.144.115.33","TCP","215","52518  >  5222 [PSH, ACK] Seq=2445 Ack=319 Win=65024 Len=161 [TCP PDU reassembled in 113]"
"92","1.433914","57.144.115.33","192.168.101.13","TCP","56","5222  >  52518 [ACK] Seq=319 Ack=2326 Win=69888 Len=0"
"93","1.433914","57.144.115.33","192.168.101.13","TCP","56","5222  >  52518 [ACK] Seq=319 Ack=2445 Win=69888 Len=0"
"94","1.433914","57.144.115.33","192.168.101.13","TCP","56","5222  >  52518 [ACK] Seq=319 Ack=2606 Win=70912 Len=0"
"95","1.505999","57.144.115.33","192.168.101.13","TCP","103","5222  >  52518 [PSH, ACK] Seq=319 Ack=2606 Win=70912 Len=49 [TCP PDU reassembled in 119]"
"96","1.505999","57.144.115.33","192.168.101.13","TCP","367","5222  >  52518 [PSH, ACK] Seq=368 Ack=2606 Win=70912 Len=313 [TCP PDU reassembled in 119]"
"97","1.505999","57.144.115.33","192.168.101.13","TCP","91","5222  >  52518 [PSH, ACK] Seq=681 Ack=2606 Win=70912 Len=37 [TCP PDU reassembled in 119]"
"98","1.506199","192.168.101.13","57.144.115.33","TCP","54","52518  >  5222 [ACK] Seq=2606 Ack=718 Win=64768 Len=0"
"99","1.510518","192.168.101.13","57.144.115.33","TCP","174","52518  >  5222 [PSH, ACK] Seq=2606 Ack=718 Win=64768 Len=120 [TCP PDU reassembled in 113]"
"100","1.510625","192.168.101.13","57.144.115.33","TCP","175","52518  >  5222 [PSH, ACK] Seq=2726 Ack=718 Win=64768 Len=121 [TCP PDU reassembled in 113]"
"101","1.510685","192.168.101.13","57.144.115.33","TCP","102","52518  >  5222 [PSH, ACK] Seq=2847 Ack=718 Win=64768 Len=48 [TCP PDU reassembled in 113]"
"102","1.511828","192.168.101.13","57.144.115.33","TCP","174","52518  >  5222 [PSH, ACK] Seq=2895 Ack=718 Win=64768 Len=120 [TCP PDU reassembled in 113]"
"103","1.512280","192.168.101.13","57.144.115.33","TCP","176","52518  >  5222 [PSH, ACK] Seq=3015 Ack=718 Win=64768 Len=122 [TCP PDU reassembled in 113]"
"104","1.512382","192.168.101.13","57.144.115.33","TCP","102","52518  >  5222 [PSH, ACK] Seq=3137 Ack=718 Win=64768 Len=48 [TCP PDU reassembled in 113]"
"105","1.638724","57.144.115.33","192.168.101.13","TCP","369","5222  >  52518 [PSH, ACK] Seq=718 Ack=2606 Win=70912 Len=315 [TCP PDU reassembled in 119]"
"106","1.638724","57.144.115.33","192.168.101.13","TCP","56","5222  >  52518 [ACK] Seq=1033 Ack=2895 Win=70912 Len=0"
"107","1.638724","57.144.115.33","192.168.101.13","TCP","56","5222  >  52518 [ACK] Seq=1033 Ack=3137 Win=70912 Len=0"
"108","1.638724","57.144.115.33","192.168.101.13","TCP","174","5222  >  52518 [PSH, ACK] Seq=1033 Ack=3185 Win=70912 Len=120 [TCP PDU reassembled in 119]"
"109","1.638724","57.144.115.33","192.168.101.13","TCP","107","5222  >  52518 [PSH, ACK] Seq=1153 Ack=3185 Win=70912 Len=53 [TCP PDU reassembled in 119]"
"110","1.638724","57.144.115.33","192.168.101.13","TCP","96","5222  >  52518 [PSH, ACK] Seq=1206 Ack=3185 Win=70912 Len=42 [TCP PDU reassembled in 119]"
"111","1.638724","57.144.115.33","192.168.101.13","TCP","214","5222  >  52518 [PSH, ACK] Seq=1248 Ack=3185 Win=70912 Len=160 [TCP PDU reassembled in 119]"
"112","1.638973","192.168.101.13","57.144.115.33","TCP","54","52518  >  5222 [ACK] Seq=3185 Ack=1408 Win=65280 Len=0"
"113","1.652735","192.168.101.13","57.144.115.33","TCP","126","52518  >  5222 [PSH, ACK] Seq=3185 Ack=1408 Win=65280 Len=72 [TCP PDU reassembled in 113]"
"114","1.843533","57.144.115.33","192.168.101.13","TCP","284","5222  >  52518 [PSH, ACK] Seq=1408 Ack=3185 Win=70912 Len=230 [TCP PDU reassembled in 119]"
"115","1.843533","57.144.115.33","192.168.101.13","TCP","153","5222  >  52518 [PSH, ACK] Seq=1638 Ack=3185 Win=70912 Len=99 [TCP PDU reassembled in 119]"
"116","1.843533","57.144.115.33","192.168.101.13","TCP","153","5222  >  52518 [PSH, ACK] Seq=1737 Ack=3185 Win=70912 Len=99 [TCP PDU reassembled in 119]"
"117","1.843533","57.144.115.33","192.168.101.13","TCP","286","5222  >  52518 [PSH, ACK] Seq=1836 Ack=3185 Win=70912 Len=232 [TCP PDU reassembled in 119]"
"118","1.843533","57.144.115.33","192.168.101.13","TCP","56","5222  >  52518 [ACK] Seq=2068 Ack=3257 Win=70912 Len=0"
"119","1.843533","57.144.115.33","192.168.101.13","TCP","97","5222  >  52518 [PSH, ACK] Seq=2068 Ack=3257 Win=70912 Len=43 [TCP PDU reassembled in 119]"
"120","1.843775","192.168.101.13","57.144.115.33","TCP","54","52518  >  5222 [ACK] Seq=3257 Ack=2111 Win=64768 Len=0"
"121","3.686896","zhiyicommuni_49:83:8c","Broadcast","ARP","60","Who has 192.168.101.13? Tell 192.168.101.1"
"122","3.686979","AzureWaveTec_df:75:0d","zhiyicommuni_49:83:8c","ARP","42","192.168.101.13 is at 14:13:33:df:75:0d"
"123","3.923829","fe80::f036:1b87:d1eb:960a","fe80::1","DNS","93","Standard query 0x9e11 A wpad.bbrouter"
"124","3.923973","fe80::f036:1b87:d1eb:960a","fe80::1","DNS","93","Standard query 0x85ec AAAA wpad.bbrouter"
"125","3.926142","fe80::1","fe80::f036:1b87:d1eb:960a","DNS","93","Standard query response 0x9e11 No such name A wpad.bbrouter"
"126","3.926142","fe80::1","fe80::f036:1b87:d1eb:960a","DNS","93","Standard query response 0x85ec No such name AAAA wpad.bbrouter"
"127","6.349110","zhiyicommuni_49:83:8c","Broadcast","ARP","60","Who has 192.168.101.13? Tell 192.168.101.1"
"128","6.349186","AzureWaveTec_df:75:0d","zhiyicommuni_49:83:8c","ARP","42","192.168.101.13 is at 14:13:33:df:75:0d"
"129","7.106502","2803:b2a0:82:d894:7065:ca3:f8fe:e0ed","2600:1419:5600:7::5c7a:9d84","TCP","1418","52516  >  443 [ACK] Seq=1 Ack=1 Win=252 Len=1344 [TCP PDU reassembled in 133]"
"130","7.106502","2803:b2a0:82:d894:7065:ca3:f8fe:e0ed","2600:1419:5600:7::5c7a:9d84","TCP","1418","52516  >  443 [ACK] Seq=1345 Ack=1 Win=252 Len=1344 [TCP PDU reassembled in 133]"
"131","7.106502","2803:b2a0:82:d894:7065:ca3:f8fe:e0ed","2600:1419:5600:7::5c7a:9d84","TCP","1418","52516  >  443 [ACK] Seq=2689 Ack=1 Win=252 Len=1344 [TCP PDU reassembled in 133]"
"132","7.106502","2803:b2a0:82:d894:7065:ca3:f8fe:e0ed","2600:1419:5600:7::5c7a:9d84","TCP","1418","52516  >  443 [ACK] Seq=4033 Ack=1 Win=252 Len=1344 [TCP PDU reassembled in 133]"
"133","7.106502","2803:b2a0:82:d894:7065:ca3:f8fe:e0ed","2600:1419:5600:7::5c7a:9d84","TLSv1.2","91","Application Data"
"134","7.106657","2803:b2a0:82:d894:7065:ca3:f8fe:e0ed","2600:1419:5600:7::5c7a:9d84","TCP","1418","52516  >  443 [ACK] Seq=5394 Ack=1 Win=252 Len=1344 [TCP PDU reassembled in 135]"
"135","7.106657","2803:b2a0:82:d894:7065:ca3:f8fe:e0ed","2600:1419:5600:7::5c7a:9d84","TLSv1.2","998","Application Data"
"136","7.168507","2600:1419:5600:7::5c7a:9d84","2803:b2a0:82:d894:7065:ca3:f8fe:e0ed","TCP","74","443  >  52516 [ACK] Seq=1 Ack=2689 Win=613 Len=0"
"137","7.168507","2600:1419:5600:7::5c7a:9d84","2803:b2a0:82:d894:7065:ca3:f8fe:e0ed","TCP","74","443  >  52516 [ACK] Seq=1 Ack=5394 Win=592 Len=0"
"138","7.168507","2600:1419:5600:7::5c7a:9d84","2803:b2a0:82:d894:7065:ca3:f8fe:e0ed","TCP","74","443  >  52516 [ACK] Seq=1 Ack=6738 Win=582 Len=0"
"139","7.168507","2600:1419:5600:7::5c7a:9d84","2803:b2a0:82:d894:7065:ca3:f8fe:e0ed","TCP","74","443  >  52516 [ACK] Seq=1 Ack=7662 Win=575 Len=0"
"140","7.249679","2600:1419:5600:7::5c7a:9d84","2803:b2a0:82:d894:7065:ca3:f8fe:e0ed","TLSv1.2","273","Application Data"
"141","7.250099","2600:1419:5600:7::5c7a:9d84","2803:b2a0:82:d894:7065:ca3:f8fe:e0ed","TLSv1.2","105","Application Data"
"142","7.250188","2803:b2a0:82:d894:7065:ca3:f8fe:e0ed","2600:1419:5600:7::5c7a:9d84","TCP","74","52516  >  443 [ACK] Seq=7662 Ack=231 Win=251 Len=0"
"143","9.011886","zhiyicommuni_49:83:8c","Broadcast","ARP","60","Who has 192.168.101.13? Tell 192.168.101.1"
"144","9.011957","AzureWaveTec_df:75:0d","zhiyicommuni_49:83:8c","ARP","42","192.168.101.13 is at 14:13:33:df:75:0d"
"145","10.171687","fe80::f036:1b87:d1eb:960a","fe80::1","DNS","93","Standard query 0x15dd A wpad.bbrouter"
"146","10.171687","fe80::f036:1b87:d1eb:960a","fe80::1","DNS","93","Standard query 0x7e48 AAAA wpad.bbrouter"
"147","10.172125","fe80::f036:1b87:d1eb:960a","fe80::1","DNS","93","Standard query 0x326b A wpad.bbrouter"
"148","10.172337","fe80::f036:1b87:d1eb:960a","fe80::1","DNS","93","Standard query 0xcafb AAAA wpad.bbrouter"
"149","10.175510","fe80::1","fe80::f036:1b87:d1eb:960a","DNS","93","Standard query response 0x15dd No such name A wpad.bbrouter"
"150","10.175510","fe80::1","fe80::f036:1b87:d1eb:960a","DNS","93","Standard query response 0x7e48 No such name AAAA wpad.bbrouter"
"151","10.175510","fe80::1","fe80::f036:1b87:d1eb:960a","DNS","93","Standard query response 0x326b No such name A wpad.bbrouter"
"152","10.175510","fe80::1","fe80::f036:1b87:d1eb:960a","DNS","93","Standard query response 0xcafb No such name AAAA wpad.bbrouter"
"153","10.965530","fe80::f036:1b87:d1eb:960a","ff02::1:ff00:1","ICMPv6","86","Neighbor Solicitation for fe80::1 from 14:13:33:df:75:0d"
"154","10.967520","fe80::1","fe80::f036:1b87:d1eb:960a","ICMPv6","86","Neighbor Advertisement fe80::1 (rtr, sol, ovr) is at 74:54:6b:49:83:8c"
"155","10.989738","fe80::f036:1b87:d1eb:960a","ff02::1:ff00:1","ICMPv6","86","Neighbor Solicitation for fe80::1 from 14:13:33:df:75:0d"
"156","10.990918","fe80::1","fe80::f036:1b87:d1eb:960a","ICMPv6","86","Neighbor Advertisement fe80::1 (rtr, sol, ovr) is at 74:54:6b:49:83:8c"
"157","10.997849","fe80::f036:1b87:d1eb:960a","fe80::1","DNS","96","Standard query 0xfbfd AAAA dns.msftncsi.com"
"158","11.059595","fe80::1","fe80::f036:1b87:d1eb:960a","DNS","124","Standard query response 0xfbfd AAAA dns.msftncsi.com AAAA fd3e:4f5a:5b81::1"
"159","12.596068","zhiyicommuni_49:83:8c","Broadcast","ARP","60","Who has 192.168.101.13? Tell 192.168.101.1"
"160","12.596142","AzureWaveTec_df:75:0d","zhiyicommuni_49:83:8c","ARP","42","192.168.101.13 is at 14:13:33:df:75:0d"
"161","12.943971","192.168.101.13","57.144.115.33","TCP","54","52518  >  5222 [FIN, ACK] Seq=3257 Ack=2111 Win=64768 Len=0"
"162","13.005229","57.144.115.33","192.168.101.13","TCP","56","5222  >  52518 [ACK] Seq=2111 Ack=3258 Win=70912 Len=0"
"163","13.107933","57.144.115.33","192.168.101.13","TCP","54","5222  >  52518 [FIN, ACK] Seq=2111 Ack=3258 Win=70912 Len=0"
"164","13.108116","192.168.101.13","57.144.115.33","TCP","54","52518  >  5222 [ACK] Seq=3258 Ack=2112 Win=64768 Len=0"
"165","15.258546","zhiyicommuni_49:83:8c","Broadcast","ARP","60","Who has 192.168.101.13? Tell 192.168.101.1"
"166","15.258619","AzureWaveTec_df:75:0d","zhiyicommuni_49:83:8c","ARP","42","192.168.101.13 is at 14:13:33:df:75:0d"
"167","15.370439","AzureWaveTec_df:75:0d","Broadcast","ARP","42","Who has 192.168.101.1? Tell 192.168.101.13"
"168","15.371591","zhiyicommuni_49:83:8c","AzureWaveTec_df:75:0d","ARP","42","192.168.101.1 is at 74:54:6b:49:83:8c"
"169","15.393081","fe80::f036:1b87:d1eb:960a","fe80::1","DNS","96","Standard query 0x79fc A dns.msftncsi.com"
"170","15.463404","fe80::1","fe80::f036:1b87:d1eb:960a","DNS","112","Standard query response 0x79fc A dns.msftncsi.com A 131.107.255.255"
"171","15.977264","fe80::1","fe80::f036:1b87:d1eb:960a","ICMPv6","86","Neighbor Solicitation for fe80::f036:1b87:d1eb:960a from 74:54:6b:49:83:8c"
"172","15.977547","fe80::f036:1b87:d1eb:960a","fe80::1","ICMPv6","86","Neighbor Advertisement fe80::f036:1b87:d1eb:960a (sol, ovr) is at 14:13:33:df:75:0d"
"173","17.764092","fe80::f036:1b87:d1eb:960a","fe80::1","DNS","104","Standard query 0x2870 A ipv6.msftconnecttest.com"
"174","17.764092","fe80::f036:1b87:d1eb:960a","fe80::1","DNS","104","Standard query 0xd983 AAAA ipv6.msftconnecttest.com"
"175","17.778022","fe80::f036:1b87:d1eb:960a","fe80::1","DNS","103","Standard query 0xdb48 A www.msftconnecttest.com"
"176","17.778018","fe80::f036:1b87:d1eb:960a","fe80::1","DNS","103","Standard query 0xf874 AAAA www.msftconnecttest.com"
"177","17.818512","fe80::1","fe80::f036:1b87:d1eb:960a","DNS","284","Standard query response 0xd983 AAAA ipv6.msftconnecttest.com CNAME ncsiv6-geo.trafficmanager.net CNAME ipv6.msftconnecttest.com.edgesuite.net CNAME a1968.i6g1.akamai.net AAAA 2600:1402:b800:3::172f:cc37 AAAA 2600:1402:b800:3::172f:cc46"
"178","17.818512","fe80::1","fe80::f036:1b87:d1eb:960a","DNS","289","Standard query response 0x2870 A ipv6.msftconnecttest.com CNAME ncsiv6-geo.trafficmanager.net CNAME ipv6.msftconnecttest.com.edgesuite.net CNAME a1968.i6g1.akamai.net SOA n0i6g1.akamai.net"
"179","17.818512","fe80::1","fe80::f036:1b87:d1eb:960a","DNS","274","Standard query response 0xf874 AAAA www.msftconnecttest.com CNAME ncsi-geo.trafficmanager.net CNAME www.msftncsi.com.edgesuite.net CNAME a1961.g2.akamai.net SOA n0g2.akamai.net"
"180","17.818512","fe80::1","fe80::f036:1b87:d1eb:960a","DNS","247","Standard query response 0xdb48 A www.msftconnecttest.com CNAME ncsi-geo.trafficmanager.net CNAME www.msftncsi.com.edgesuite.net CNAME a1961.g2.akamai.net A 23.50.120.199 A 23.50.120.198"
"181","17.821875","2803:b2a0:82:d894:7065:ca3:f8fe:e0ed","2600:1402:b800:3::172f:cc37","TCP","86","52519  >  80 [SYN] Seq=0 Win=65535 Len=0 MSS=1432 WS=256 SACK_PERM"
"182","17.821910","192.168.101.13","23.50.120.199","TCP","66","52520  >  80 [SYN] Seq=0 Win=65535 Len=0 MSS=1460 WS=256 SACK_PERM"
"183","17.920749","zhiyicommuni_49:83:8c","Broadcast","ARP","60","Who has 192.168.101.13? Tell 192.168.101.1"
"184","17.920824","AzureWaveTec_df:75:0d","zhiyicommuni_49:83:8c","ARP","42","192.168.101.13 is at 14:13:33:df:75:0d"
"185","17.920902","23.50.120.199","192.168.101.13","TCP","66","80  >  52520 [SYN, ACK] Seq=0 Ack=1 Win=64240 Len=0 MSS=1452 SACK_PERM WS=128"
"186","17.920902","2600:1402:b800:3::172f:cc37","2803:b2a0:82:d894:7065:ca3:f8fe:e0ed","TCP","86","80  >  52519 [SYN, ACK] Seq=0 Ack=1 Win=64800 Len=0 MSS=1432 SACK_PERM WS=128"
"187","17.921160","192.168.101.13","23.50.120.199","TCP","54","52520  >  80 [ACK] Seq=1 Ack=1 Win=65280 Len=0"
"188","17.921316","2803:b2a0:82:d894:7065:ca3:f8fe:e0ed","2600:1402:b800:3::172f:cc37","TCP","74","52519  >  80 [ACK] Seq=1 Ack=1 Win=65280 Len=0"
"189","17.923467","192.168.101.13","23.50.120.199","HTTP","208","GET /connecttest.txt HTTP/1.1 "
"190","17.923507","2803:b2a0:82:d894:7065:ca3:f8fe:e0ed","2600:1402:b800:3::172f:cc37","HTTP","229","GET /connecttest.txt HTTP/1.1 "
"191","18.023043","23.50.120.199","192.168.101.13","TCP","54","80  >  52520 [ACK] Seq=1 Ack=155 Win=64128 Len=0"
"192","18.023043","23.50.120.199","192.168.101.13","HTTP","241","HTTP/1.1 200 OK  (text/plain)"
"193","18.023043","23.50.120.199","192.168.101.13","TCP","54","80  >  52520 [FIN, ACK] Seq=188 Ack=155 Win=64128 Len=0"
"194","18.023043","2600:1402:b800:3::172f:cc37","2803:b2a0:82:d894:7065:ca3:f8fe:e0ed","TCP","74","80  >  52519 [ACK] Seq=1 Ack=156 Win=64768 Len=0"
"195","18.023043","2600:1402:b800:3::172f:cc37","2803:b2a0:82:d894:7065:ca3:f8fe:e0ed","HTTP","261","HTTP/1.1 200 OK  (text/plain)"
"196","18.023043","2600:1402:b800:3::172f:cc37","2803:b2a0:82:d894:7065:ca3:f8fe:e0ed","TCP","74","80  >  52519 [FIN, ACK] Seq=188 Ack=156 Win=64768 Len=0"
"197","18.028269","2803:b2a0:82:d894:7065:ca3:f8fe:e0ed","2600:1402:b800:3::172f:cc37","TCP","74","52519  >  80 [ACK] Seq=156 Ack=189 Win=65280 Len=0"
"198","18.028269","192.168.101.13","23.50.120.199","TCP","54","52520  >  80 [ACK] Seq=155 Ack=189 Win=65280 Len=0"
"199","18.028417","192.168.101.13","23.50.120.199","TCP","54","52520  >  80 [FIN, ACK] Seq=155 Ack=189 Win=65280 Len=0"
"200","18.028449","2803:b2a0:82:d894:7065:ca3:f8fe:e0ed","2600:1402:b800:3::172f:cc37","TCP","74","52519  >  80 [FIN, ACK] Seq=156 Ack=189 Win=65280 Len=0"
"201","18.028579","192.168.101.13","23.50.120.199","TCP","54","52520  >  80 [RST, ACK] Seq=156 Ack=189 Win=0 Len=0"
"202","18.028584","2803:b2a0:82:d894:7065:ca3:f8fe:e0ed","2600:1402:b800:3::172f:cc37","TCP","74","52519  >  80 [RST, ACK] Seq=157 Ack=189 Win=0 Len=0"
"203","18.125726","23.50.120.199","192.168.101.13","TCP","54","80  >  52520 [ACK] Seq=189 Ack=156 Win=64128 Len=0"
"204","18.125726","2600:1402:b800:3::172f:cc37","2803:b2a0:82:d894:7065:ca3:f8fe:e0ed","TCP","74","80  >  52519 [ACK] Seq=189 Ack=157 Win=64768 Len=0"
"205","18.125885","192.168.101.13","23.50.120.199","TCP","54","52520  >  80 [RST] Seq=156 Win=0 Len=0"
"206","18.125979","2803:b2a0:82:d894:7065:ca3:f8fe:e0ed","2600:1402:b800:3::172f:cc37","TCP","74","52519  >  80 [RST] Seq=157 Win=0 Len=0"
"207","18.727082","fe80::f036:1b87:d1eb:960a","fe80::1","DNS","93","Standard query 0xa6d1 A ipm.avcdn.net"
"208","18.754502","fe80::1","fe80::f036:1b87:d1eb:960a","DNS","175","Standard query response 0xa6d1 A ipm.avcdn.net CNAME ipm-provider.ff.avast.com CNAME ipm-gcp-prod.ff.avast.com A 34.111.24.1"
"209","18.834137","fe80::f036:1b87:d1eb:960a","fe80::1","DNS","100","Standard query 0x7c10 A ip-info.ff.avast.com"
"210","18.852183","fe80::1","fe80::f036:1b87:d1eb:960a","DNS","142","Standard query response 0x7c10 A ip-info.ff.avast.com CNAME ip-info-gcp.ff.avast.com A 34.111.175.102"
"211","18.861346","2803:b2a0:82:d894:7065:ca3:f8fe:e0ed","2600:1901:0:ba6b::","TCP","86","52521  >  80 [SYN] Seq=0 Win=65535 Len=0 MSS=1432 WS=256 SACK_PERM"
"212","18.944611","2600:1901:0:ba6b::","2803:b2a0:82:d894:7065:ca3:f8fe:e0ed","TCP","86","80  >  52521 [SYN, ACK] Seq=0 Ack=1 Win=65535 Len=0 MSS=1432 SACK_PERM WS=256"
"213","18.944844","2803:b2a0:82:d894:7065:ca3:f8fe:e0ed","2600:1901:0:ba6b::","TCP","74","52521  >  80 [ACK] Seq=1 Ack=1 Win=65280 Len=0"
"214","18.945048","2803:b2a0:82:d894:7065:ca3:f8fe:e0ed","2600:1901:0:ba6b::","HTTP","220","GET /v1/info HTTP/1.1 "
"215","19.047076","2600:1901:0:ba6b::","2803:b2a0:82:d894:7065:ca3:f8fe:e0ed","TCP","74","80  >  52521 [ACK] Seq=1 Ack=147 Win=269312 Len=0"
"216","19.149465","2600:1901:0:ba6b::","2803:b2a0:82:d894:7065:ca3:f8fe:e0ed","HTTP/JSON","872","HTTP/1.1 200 OK , JSON (application/json)"
"217","19.202176","2803:b2a0:82:d894:7065:ca3:f8fe:e0ed","2600:1901:0:ba6b::","TCP","74","52521  >  80 [ACK] Seq=147 Ack=799 Win=64512 Len=0"
"218","21.505126","zhiyicommuni_49:83:8c","Broadcast","ARP","60","Who has 192.168.101.13? Tell 192.168.101.1"
"219","21.505202","AzureWaveTec_df:75:0d","zhiyicommuni_49:83:8c","ARP","42","192.168.101.13 is at 14:13:33:df:75:0d"
"220","22.941122","fe80::1","2803:b2a0:82:d894:7065:ca3:f8fe:e0ed","ICMPv6","86","Neighbor Solicitation for 2803:b2a0:82:d894:7065:ca3:f8fe:e0ed from 74:54:6b:49:83:8c"
"221","22.941430","2803:b2a0:82:d894:7065:ca3:f8fe:e0ed","fe80::1","ICMPv6","86","Neighbor Advertisement 2803:b2a0:82:d894:7065:ca3:f8fe:e0ed (sol, ovr) is at 14:13:33:df:75:0d"
"222","24.065274","zhiyicommuni_49:83:8c","Broadcast","ARP","60","Who has 192.168.101.13? Tell 192.168.101.1"
"223","24.065351","AzureWaveTec_df:75:0d","zhiyicommuni_49:83:8c","ARP","42","192.168.101.13 is at 14:13:33:df:75:0d"
"224","26.010983","192.168.101.3","192.168.101.255","UDP","82","57621  >  57621 Len=40"
"225","27.751796","zhiyicommuni_49:83:8c","Broadcast","ARP","60","Who has 192.168.101.13? Tell 192.168.101.1"
"226","27.751879","AzureWaveTec_df:75:0d","zhiyicommuni_49:83:8c","ARP","42","192.168.101.13 is at 14:13:33:df:75:0d"
"227","30.414342","zhiyicommuni_49:83:8c","Broadcast","ARP","60","Who has 192.168.101.13? Tell 192.168.101.1"
"228","30.414416","AzureWaveTec_df:75:0d","zhiyicommuni_49:83:8c","ARP","42","192.168.101.13 is at 14:13:33:df:75:0d"
"229","33.076759","zhiyicommuni_49:83:8c","Broadcast","ARP","60","Who has 192.168.101.13? Tell 192.168.101.1"
"230","33.076834","AzureWaveTec_df:75:0d","zhiyicommuni_49:83:8c","ARP","42","192.168.101.13 is at 14:13:33:df:75:0d"
"231","33.287167","fe80::f036:1b87:d1eb:960a","fe80::1","DNS","100","Standard query 0x7c71 TXT config.nos.avast.com"
"232","33.383675","fe80::1","fe80::f036:1b87:d1eb:960a","DNS","204","Standard query response 0x7c71 TXT config.nos.avast.com TXT"
"233","33.386005","fe80::f036:1b87:d1eb:960a","fe80::1","DNS","103","Standard query 0xc087 SRV _nos._tcp.nos.avast.com"
"234","33.486029","fe80::1","fe80::f036:1b87:d1eb:960a","DNS","183","Standard query response 0xc087 SRV _nos._tcp.nos.avast.com SRV 50 80 7500 nos.ns1.ff.avast.com SRV 50 80 443 nos.ns1.ff.avast.com"
"235","33.488766","fe80::f036:1b87:d1eb:960a","fe80::1","DNS","100","Standard query 0x50b9 A nos.ns1.ff.avast.com"
"236","33.488792","fe80::f036:1b87:d1eb:960a","fe80::1","DNS","100","Standard query 0x88dc AAAA nos.ns1.ff.avast.com"
"237","33.588422","fe80::1","fe80::f036:1b87:d1eb:960a","DNS","180","Standard query response 0x50b9 A nos.ns1.ff.avast.com A 34.159.75.126 A 34.76.221.58 A 35.233.208.117 A 35.240.117.153 A 34.159.16.223"
"238","33.588422","fe80::1","fe80::f036:1b87:d1eb:960a","DNS","165","Standard query response 0x88dc AAAA nos.ns1.ff.avast.com SOA dns1.p02.nsone.net"
"239","33.592407","192.168.101.13","34.159.75.126","TCP","66","52522  >  443 [SYN] Seq=0 Win=65535 Len=0 MSS=1460 WS=256 SACK_PERM"
"240","33.793530","34.159.75.126","192.168.101.13","TCP","62","443  >  52522 [SYN, ACK] Seq=0 Ack=1 Win=1420 Len=0 MSS=1420 WS=4"
"241","33.793775","192.168.101.13","34.159.75.126","TCP","54","52522  >  443 [ACK] Seq=1 Ack=1 Win=65280 Len=0"
"242","33.815321","192.168.101.13","34.159.75.126","TCP","183","52522  >  443 [PSH, ACK] Seq=1 Ack=1 Win=65280 Len=129"
"243","34.176814","fe80::f036:1b87:d1eb:960a","fe80::1","DNS","90","Standard query 0xa349 AAAA c.pki.goog"
"244","34.176814","fe80::f036:1b87:d1eb:960a","fe80::1","DNS","90","Standard query 0x6bee A c.pki.goog"
"245","34.178550","34.159.75.126","192.168.101.13","TCP","54","443  >  52522 [ACK] Seq=1 Ack=130 Win=1292 Len=0"
"246","34.178550","34.159.75.126","192.168.101.13","TCP","70","443  >  52522 [PSH, ACK] Seq=1 Ack=130 Win=1420 Len=16"
"247","34.202783","fe80::1","fe80::f036:1b87:d1eb:960a","DNS","141","Standard query response 0x6bee A c.pki.goog CNAME pki-goog.l.google.com A 172.217.30.195"
"248","34.202783","fe80::1","fe80::f036:1b87:d1eb:960a","DNS","153","Standard query response 0xa349 AAAA c.pki.goog CNAME pki-goog.l.google.com AAAA 2607:f8b0:4002:c09::5e"
"249","34.209045","2803:b2a0:82:d894:7065:ca3:f8fe:e0ed","2607:f8b0:4002:c09::5e","TCP","86","52523  >  80 [SYN] Seq=0 Win=65535 Len=0 MSS=1432 WS=256 SACK_PERM"
"250","34.221484","192.168.101.13","34.159.75.126","TCP","54","52522  >  443 [ACK] Seq=130 Ack=17 Win=65280 Len=0"
"251","34.305260","2607:f8b0:4002:c09::5e","2803:b2a0:82:d894:7065:ca3:f8fe:e0ed","TCP","86","80  >  52523 [SYN, ACK] Seq=0 Ack=1 Win=65535 Len=0 MSS=1432 SACK_PERM WS=256"
"252","34.305582","2803:b2a0:82:d894:7065:ca3:f8fe:e0ed","2607:f8b0:4002:c09::5e","TCP","74","52523  >  80 [ACK] Seq=1 Ack=1 Win=65280 Len=0"
"253","34.307700","2803:b2a0:82:d894:7065:ca3:f8fe:e0ed","2607:f8b0:4002:c09::5e","HTTP","274","GET /r/r1.crl HTTP/1.1 "
"254","34.407667","2607:f8b0:4002:c09::5e","2803:b2a0:82:d894:7065:ca3:f8fe:e0ed","TCP","74","80  >  52523 [ACK] Seq=1 Ack=201 Win=269312 Len=0"
"255","34.407667","2607:f8b0:4002:c09::5e","2803:b2a0:82:d894:7065:ca3:f8fe:e0ed","TCP","1294","80  >  52523 [ACK] Seq=1 Ack=201 Win=269312 Len=1220 [TCP PDU reassembled in 256]"
"256","34.407667","2607:f8b0:4002:c09::5e","2803:b2a0:82:d894:7065:ca3:f8fe:e0ed","PKIX-CRL","560","Certificate Revocation List"
"257","34.407667","34.159.75.126","192.168.101.13","TCP","91","443  >  52522 [PSH, ACK] Seq=17 Ack=130 Win=1420 Len=37"
"258","34.423281","fe80::f036:1b87:d1eb:960a","fe80::1","DNS","94","Standard query 0xb1cd A x1.c.lencr.org"
"259","34.423281","fe80::f036:1b87:d1eb:960a","fe80::1","DNS","94","Standard query 0x3f16 AAAA x1.c.lencr.org"
"260","34.457804","2803:b2a0:82:d894:7065:ca3:f8fe:e0ed","2607:f8b0:4002:c09::5e","TCP","74","52523  >  80 [ACK] Seq=201 Ack=1707 Win=65280 Len=0"
"261","34.457897","192.168.101.13","34.159.75.126","TCP","54","52522  >  443 [ACK] Seq=130 Ack=54 Win=65280 Len=0"
"262","34.510379","fe80::1","fe80::f036:1b87:d1eb:960a","DNS","199","Standard query response 0xb1cd A x1.c.lencr.org CNAME crl.root-x1.letsencrypt.org.edgekey.net CNAME e8652.dscx.akamaiedge.net A 2.19.33.124"
"263","34.510379","fe80::1","fe80::f036:1b87:d1eb:960a","DNS","239","Standard query response 0x3f16 AAAA x1.c.lencr.org CNAME crl.root-x1.letsencrypt.org.edgekey.net CNAME e8652.dscx.akamaiedge.net AAAA 2600:1419:c200:79c::21cc AAAA 2600:1419:c200:79d::21cc"
"264","34.513841","2803:b2a0:82:d894:7065:ca3:f8fe:e0ed","2600:1419:c200:79c::21cc","TCP","86","52524  >  80 [SYN] Seq=0 Win=65535 Len=0 MSS=1432 WS=256 SACK_PERM"
"265","34.612749","2600:1419:c200:79c::21cc","2803:b2a0:82:d894:7065:ca3:f8fe:e0ed","TCP","86","80  >  52524 [SYN, ACK] Seq=0 Ack=1 Win=64800 Len=0 MSS=1432 SACK_PERM WS=128"
"266","34.613037","2803:b2a0:82:d894:7065:ca3:f8fe:e0ed","2600:1419:c200:79c::21cc","TCP","74","52524  >  80 [ACK] Seq=1 Ack=1 Win=65280 Len=0"
"267","34.615077","2803:b2a0:82:d894:7065:ca3:f8fe:e0ed","2600:1419:c200:79c::21cc","HTTP","301","GET / HTTP/1.1 "
"268","34.714882","2600:1419:c200:79c::21cc","2803:b2a0:82:d894:7065:ca3:f8fe:e0ed","TCP","74","80  >  52524 [ACK] Seq=1 Ack=228 Win=64640 Len=0"
"269","34.714882","2600:1419:c200:79c::21cc","2803:b2a0:82:d894:7065:ca3:f8fe:e0ed","HTTP","337","HTTP/1.1 304 Not Modified "
"270","34.757215","2803:b2a0:82:d894:7065:ca3:f8fe:e0ed","2600:1419:c200:79c::21cc","TCP","74","52524  >  80 [ACK] Seq=228 Ack=264 Win=65024 Len=0"
"271","35.109871","fe80::f036:1b87:d1eb:960a","fe80::1","DNS","111","Standard query 0x3baf A settings-win.data.microsoft.com"
"272","35.109871","fe80::f036:1b87:d1eb:960a","fe80::1","DNS","111","Standard query 0x8927 AAAA settings-win.data.microsoft.com"
"273","35.204738","192.168.101.13","45.238.181.3","DNS","91","Standard query 0x8927 AAAA settings-win.data.microsoft.com"
"274","35.204738","192.168.101.13","45.238.181.3","DNS","91","Standard query 0x3baf A settings-win.data.microsoft.com"
"275","35.205276","fe80::1","fe80::f036:1b87:d1eb:960a","DNS","291","Standard query response 0x8927 AAAA settings-win.data.microsoft.com CNAME atm-settingsfe-prod-geo2.trafficmanager.net CNAME settings-prod-sea-1.southeastasia.cloudapp.azure.com SOA ns1-01.azure-dns.com"
"276","35.205276","fe80::1","fe80::f036:1b87:d1eb:960a","DNS","241","Standard query response 0x3baf A settings-win.data.microsoft.com CNAME atm-settingsfe-prod-geo2.trafficmanager.net CNAME settings-prod-uks-1.uksouth.cloudapp.azure.com A 51.11.168.232"
"277","35.207411","192.168.101.13","51.11.168.232","TCP","66","52525  >  443 [SYN] Seq=0 Win=65535 Len=0 MSS=1460 WS=256 SACK_PERM"
"278","35.226873","45.238.181.3","192.168.101.13","DNS","270","Standard query response 0x8927 AAAA settings-win.data.microsoft.com CNAME atm-settingsfe-prod-geo2.trafficmanager.net CNAME settings-prod-cin-1.centralindia.cloudapp.azure.com SOA ns1-01.azure-dns.com"
"279","35.226873","45.238.181.3","192.168.101.13","DNS","226","Standard query response 0x3baf A settings-win.data.microsoft.com CNAME atm-settingsfe-prod-geo2.trafficmanager.net CNAME settings-prod-cin-1.centralindia.cloudapp.azure.com A 52.140.118.28"
"280","35.431915","51.11.168.232","192.168.101.13","TCP","66","443  >  52525 [SYN, ACK] Seq=0 Ack=1 Win=65535 Len=0 MSS=1440 WS=256 SACK_PERM"
"281","35.432235","192.168.101.13","51.11.168.232","TCP","54","52525  >  443 [ACK] Seq=1 Ack=1 Win=65280 Len=0"
"282","35.434109","192.168.101.13","51.11.168.232","TLSv1.2","268","Client Hello (SNI=settings-win.data.microsoft.com)"
"283","35.636578","51.11.168.232","192.168.101.13","TCP","1506","443  >  52525 [ACK] Seq=1 Ack=215 Win=4194560 Len=1452 [TCP PDU reassembled in 285]"
"284","35.636578","51.11.168.232","192.168.101.13","TCP","1506","443  >  52525 [ACK] Seq=1453 Ack=215 Win=4194560 Len=1452 [TCP PDU reassembled in 285]"
"285","35.636578","51.11.168.232","192.168.101.13","TLSv1.2","908","Server Hello, Certificate, Server Key Exchange, Server Hello Done"
"286","35.643135","192.168.101.13","51.11.168.232","TLSv1.2","212","Client Key Exchange, Change Cipher Spec, Encrypted Handshake Message"
"287","35.841609","51.11.168.232","192.168.101.13","TLSv1.2","105","Change Cipher Spec, Encrypted Handshake Message"
"288","35.841609","51.11.168.232","192.168.101.13","TLSv1.2","123","Application Data"
"289","35.848197","192.168.101.13","51.11.168.232","TLSv1.2","141","Application Data"
"290","35.848242","192.168.101.13","51.11.168.232","TLSv1.2","1359","Application Data, Application Data"
